,Unnamed: 0,tweets,clean_text,Sentiment
2861,2861,NHS staff say care 'good enough' http://bbc.in/1jxw8UK,nhs staff say care good enough,MIXED
2862,2862,The spinal pains of the UK workforce http://bbc.in/1huumll,the spinal pains uk workforce,NEUTRAL
2863,2863,Weekend pressure builds in hospitals http://bbc.in/1jxbRyM,weekend pressure builds hospitals,NEUTRAL
2864,2864,Care home criticised in report http://bbc.in/1bIIGse,care home criticised report,NEUTRAL
2865,2865,Teen pregnancy rate 'lower still' http://bbc.in/1jwKFjv,teen pregnancy rate lower still,NEUTRAL
2866,2866,Eleven care home staff suspended http://bbc.in/1k917Gs,eleven care home staff suspended,NEUTRAL
2867,2867,Photo gallery: Healthcare challenges in Afghanistan http://bbc.in/1h9Ua81,photo gallery healthcare challenges afghanistan,NEUTRAL
2868,2868,Afghanistan medical crisis 'deepens' http://bbc.in/1h9Ubc8,afghanistan medical crisis deepens,NEUTRAL
2869,2869,Medic warns of hospital pressure http://bbc.in/1bIlYk7,medic warns hospital pressure,NEUTRAL
2870,2870,Obese 'denied' life saving treatment http://bbc.in/1bIlYk3,obese denied life saving treatment,NEGATIVE
2871,2871,Cooking meat 'may be dementia risk' http://bbc.in/1ecVxCo,cooking meat may dementia risk,NEUTRAL
2872,2872,NHS death rates 'should be ignored' http://bbc.in/1jvlqOv,nhs death rates ignored,MIXED
2873,2873,Tobacco sale ban for US campus shops http://bbc.in/1k3ErYe,tobacco sale ban us campus shops,NEUTRAL
2874,2874,NHS medical records rules 'broken' http://bbc.in/1k4SpZP,nhs medical records rules broken,NEUTRAL
2875,2875,Extra staff called in to Royal A&amp;E http://bbc.in/1h6scu3,extra staff called royal amp,NEUTRAL
2876,2876,Baby's ventilator 'removed early' http://bbc.in/1hpkXvp,baby ventilator removed early,NEUTRAL
2877,2877,Medics hail 'kidney swap' scheme http://bbc.in/1mrcACE,medics hail kidney swap scheme,NEUTRAL
2878,2878,GPs 'complacent' over HIV risk http://bbc.in/MTI8oi,gps complacent hiv risk,NEUTRAL
2879,2879,A&amp;E care to fly out to accidents http://bbc.in/1mrcAmj,amp care fly accidents,NEUTRAL
2880,2880,VIDEO: Free food bags help elderly patients http://bbc.in/Nqq4lK,video free food bags help elderly patients,NEUTRAL
2881,2881,Rare 'polio-like' disease reports http://bbc.in/1bCvXHx,rare polio like disease reports,NEUTRAL
2882,2882,Does medicine really need lab mice? http://bbc.in/1hnFdgY,does medicine really need lab mice,NEUTRAL
2883,2883,Could ECT zap worst nightmares? http://bbc.in/1padrdj,could ect zap worst nightmares,NEGATIVE
2884,2884,Councils want Neknominate warnings http://bbc.in/1e1GhZ3,councils want neknominate warnings,NEUTRAL
2885,2885,NHS trusts with deficits rise to 39 http://bbc.in/1jmMOOL,nhs trusts deficits rise,NEUTRAL
2886,2886,How does commuting affect wellbeing? http://bbc.in/1bvebpN,how commuting affect wellbeing,NEUTRAL
2887,2887,VIDEO: Video goggles for hospital patients http://bbc.in/1miecyw,video video goggles hospital patients,NEUTRAL
2888,2888,Police probe into patient deaths http://bbc.in/1jkBaDV,police probe patient deaths,NEUTRAL
2889,2889,VIDEO: Loneliness a risk in cancer patients http://bbc.in/1dWeo4C,video loneliness risk cancer patients,NEUTRAL
2890,2890,Mid Staffs faces patient death fine http://bbc.in/1dWeo4s,mid staffs faces patient death fine,NEUTRAL
2891,2891,Romanian doctors tempted by a better life http://bbc.in/1jij6u5,romanian doctors tempted better life,NEUTRAL
2892,2892,Prostate tests 'will predict risk' http://bbc.in/1dUdPrY,prostate tests predict risk,NEUTRAL
2893,2893,NHS data critics 'scaremongering' http://bbc.in/1dUdPrU,nhs data critics scaremongering,NEUTRAL
2894,2894,VIDEO: Major heart healing trial starts http://bbc.in/1jNB0Va,video major heart healing trial starts,NEUTRAL
2895,2895,Major heart healing trial starts http://bbc.in/1haYSAD,major heart healing trial starts,NEUTRAL
2896,2896,Call for hospital death rates probe http://bbc.in/1mefJWe,call hospital death rates probe,NEUTRAL
2897,2897,Nurse failed to investigate abuse http://bbc.in/1jfRPIK,nurse failed investigate abuse,NEGATIVE
2898,2898,VIDEO: Child mental health care concerns http://bbc.in/1bolRtS,video child mental health care concerns,NEUTRAL
2899,2899,'Keep focus' on Africa malaria fight http://bbc.in/Ncwkxf,keep focus africa malaria fight,NEUTRAL
2900,2900,Drug lets blind eyes 'see light' http://bbc.in/Ncwip3,drug blind eyes see light,NEUTRAL
2901,2901,Children in adult psychiatric wards http://bbc.in/1mbnJY1,children adult psychiatric wards,NEUTRAL
2902,2902,Psychotic traits tied to school move http://bbc.in/1bmiDXL,psychotic traits tied school move,NEUTRAL
2903,2903,VIDEO: Action urged over self-harm sites http://bbc.in/1gGeugZ,video action urged self harm sites,NEGATIVE
2904,2904,Food packaging health risk 'unknown' http://bbc.in/1dMjW1w,food packaging health risk unknown,NEUTRAL
2905,2905,Care.data: How did it go so wrong? http://bbc.in/1jGHIfD,care data how go wrong,MIXED
2906,2906,Scotland bucks UK drink-death trend http://bbc.in/1m9gWy0,scotland bucks uk drink death trend,NEUTRAL
2907,2907,Lifestyle 'link to miscarriage risk' http://bbc.in/1gCLpTH,lifestyle link miscarriage risk,NEUTRAL
2908,2908,VIDEO: Giant NHS database rollout delayed http://bbc.in/1j8ZgBF,video giant nhs database rollout delayed,NEUTRAL
2909,2909,Giant NHS database rollout delayed http://bbc.in/1gAOsMg,giant nhs database rollout delayed,NEUTRAL
2910,2910,Monkey's brain moves sedated avatar http://bbc.in/1gACIcC,monkey brain moves sedated avatar,NEUTRAL
2911,2911,'Deadly ambulance postcode lottery' http://bbc.in/1j7PZd1,deadly ambulance postcode lottery,NEUTRAL
2912,2912,Eating disorders can be 'fatal' http://bbc.in/1j7vehA,eating disorders fatal,NEGATIVE
2913,2913,Call for help for tongue-tie babies http://bbc.in/1oLkgSo,call help tongue tie babies,NEUTRAL
2914,2914,More ambulance staff off with stress http://bbc.in/N54naJ,more ambulance staff stress,NEGATIVE
2915,2915,VIDEO: Call for better tongue-tie care http://bbc.in/MuxPHc,video call better tongue tie care,POSITIVE
2916,2916,Test 'predicts' teen depression risk http://bbc.in/N4d7Od,test predicts teen depression risk,NEUTRAL
2917,2917,How Asperger's reignited a passion for art http://bbc.in/1gTyISW,how asperger reignited passion art,NEUTRAL
2918,2918,'Cancer monorail' can kill tumours http://bbc.in/1oFMXjI,cancer monorail kill tumours,NEUTRAL
2919,2919,The medicine in our minds http://bbc.in/1oEr6ZM,the medicine minds,NEUTRAL
2920,2920,More healing sleep for newborns http://bbc.in/Mo3utF,more healing sleep newborns,NEUTRAL
2921,2921,Computers select personal medicine http://bbc.in/1dxQoEw,computers select personal medicine,NEUTRAL
2922,2922,HG Wells: The first celebrity charity campaigner? http://bbc.in/1gHKSOr,hg wells the first celebrity charity campaigner,NEUTRAL
2923,2923,Adults 'unaware of NHS data plans' http://bbc.in/1b2Kr3i,adults unaware nhs data plans,NEUTRAL
2924,2924,AUDIO: Jab could kill brain tumour cells http://bbc.in/1dsygvQ,audio jab could kill brain tumour cells,NEUTRAL
2925,2925,VIDEO: Ex-M&amp;S boss to become NHS advisor http://bbc.in/1gfIal7,video ex amp boss become nhs advisor,NEUTRAL
2926,2926,AUDIO: Quitting smoking 'relieves stress' http://bbc.in/1gDKOiN,audio quitting smoking relieves stress,POSITIVE
2927,2927,Ex-M&amp;S boss to advise NHS managers http://bbc.in/1gBroLz,ex amp boss advise nhs managers,NEUTRAL
2928,2928,Belgium approves child euthanasia http://bbc.in/1dobjKm,belgium approves child euthanasia,NEUTRAL
2929,2929,Relative tells of A&amp;E distress http://bbc.in/1gasD5P,relative tells amp distress,NEUTRAL
2930,2930,Belgian MPs vote on child euthanasia http://bbc.in/1gasxvh,belgian mps vote child euthanasia,NEUTRAL
2931,2931,VIDEO: Breaking the silence on male rape http://bbc.in/1aXOgXf,video breaking silence male rape,NEUTRAL
2932,2932,VIDEO: Social work training reforms urged http://bbc.in/1j8tjIS,video social work training reforms urged,NEUTRAL
2933,2933,VIDEO: Psychological scars of intensive care http://bbc.in/1g9Wyv5,video psychological scars intensive care,NEUTRAL
2934,2934,Health boards consider NHS shake-up http://bbc.in/1lH7j9L,health boards consider nhs shake,NEUTRAL
2935,2935,Brain finds true beauty in maths http://bbc.in/1onroEe,brain finds true beauty maths,POSITIVE
2936,2936,'Cosmetic crisis' measures expected http://bbc.in/1onrr2V,cosmetic crisis measures expected,NEUTRAL
2937,2937,A nation of pill poppers? http://bbc.in/1aVfpKp,nation pill poppers,NEUTRAL
2938,2938,Police probe hospital pledges action http://bbc.in/Mc73TQ,police probe hospital pledges action,NEUTRAL
2939,2939,Ketamine to become Class B drug http://bbc.in/1lCu1j9,ketamine become class drug,NEGATIVE
2940,2940,AUDIO: Football-sized neck tumour removed http://bbc.in/1aUwR1F,audio football sized neck tumour removed,NEUTRAL
2941,2941,GPs add to fears over NHS database http://bbc.in/1aUf9vh,gps add fears nhs database,NEUTRAL
2942,2942,Study finds NI drug deaths different http://bbc.in/1j1E1B6,study finds ni drug deaths different,NEUTRAL
2943,2943,'Lack of clarity' over NHS savings http://bbc.in/1j0NKYn,lack clarity nhs savings,NEGATIVE
2944,2944,Rise in deaths from 'legal highs' http://bbc.in/1j0NKYj,rise deaths legal highs,NEUTRAL
2945,2945,'Millions more should take statins' http://bbc.in/MJGC7G,millions take statins,NEGATIVE
2946,2946,VIDEO: 'She is my breast cancer sister' http://bbc.in/M9Sikm,video she breast cancer sister,NEUTRAL
2947,2947,VIDEO: Dementia research: UK '30 years behind' http://bbc.in/1dg8F9m,video dementia research uk years behind,NEUTRAL
2948,2948,Car smoking ban 'due before 2015' http://bbc.in/1aQGXRj,car smoking ban due,NEUTRAL
2949,2949,Delays 'contributed to five deaths' http://bbc.in/1oeyoTR,delays contributed five deaths,NEUTRAL
2950,2950,The girl whose mouth was locked shut http://bbc.in/1iJVApN,the girl whose mouth locked shut,NEGATIVE
2951,2951,VIDEO: EU rules on child drugs 'cost lives' http://bbc.in/1iJL2qB,video eu rules child drugs cost lives,NEGATIVE
2952,2952,Ministers 'will ban car smoking' http://bbc.in/1odh29P,ministers ban car smoking,NEUTRAL
2953,2953,EU rules on child drugs 'cost lives' http://bbc.in/1dejDvZ,eu rules child drugs cost lives,NEGATIVE
2954,2954,Alarm as Kabul records polio case http://bbc.in/1debx6y,alarm kabul records polio case,NEUTRAL
2955,2955,AUDIO: Concern over new EU legal high rules http://bbc.in/MFuKDX,audio concern new eu legal high rules,NEUTRAL
2956,2956,VIDEO: Brittle bones mum achieves top goal http://bbc.in/MFuMLR,video brittle bones mum achieves top goal,NEUTRAL
2957,2957,A&amp;E review finds doctor shortage http://bbc.in/1oavKyk,amp review finds doctor shortage,NEUTRAL
2958,2958,Rise in new diabetes cases http://bbc.in/1loytCb,rise new diabetes cases,NEUTRAL
2959,2959,Belfast medics develop X-ray app http://bbc.in/1iECqBC,belfast medics develop ray app,NEUTRAL
2960,2960,MPs set to vote on car smoking ban http://bbc.in/1lmdP5w,mps set vote car smoking ban,NEUTRAL
2961,2961,Vitamin C 'keeps cancer at bay' http://bbc.in/M0r4MW,vitamin keeps cancer bay,NEUTRAL
2962,2962,Exotic Disease Detectives http://bbc.in/M0r4MR,exotic disease detectives,NEUTRAL
2963,2963,VIDEO: Tattoo boom brings potential dangers http://bbc.in/1eDQlbZ,video tattoo boom brings potential dangers,NEUTRAL
2964,2964,VIDEO: Can we erase memories entirely? http://bbc.in/1eDQlbW,video can erase memories entirely,NEGATIVE
2965,2965,'I didn't let bowel disease beat me' http://bbc.in/LY9RUs,let bowel disease beat,NEUTRAL
2966,2966,Women 'fare worse after strokes' http://bbc.in/LY9RUr,women fare worse strokes,NEGATIVE
2967,2967,VIDEO: Smoking in cars: What are the risks? http://bbc.in/1l3X2UF,video smoking cars what risks,NEUTRAL
2968,2968,Deaf children of our time http://bbc.in/1izlGuP,deaf children time,MIXED
2969,2969,Why sharing data is for greater good http://bbc.in/1aBlOuh,why sharing data greater good,MIXED
2970,2970,Health experts back car smoking ban http://bbc.in/1l2GpIZ,health experts back car smoking ban,NEUTRAL
2971,2971,Power lines: No child leukaemia risk http://bbc.in/LVhaMy,power lines no child leukaemia risk,POSITIVE
2972,2972,Measles global deaths decline by 78% http://bbc.in/1g6R963,measles global deaths decline,NEUTRAL
2973,2973,AUDIO: Charity defends pancreatic cancer ad http://bbc.in/1iw8eYB,audio charity defends pancreatic cancer ad,NEUTRAL
2974,2974,Birth order link to being overweight http://bbc.in/1iw8g2C,birth order link overweight,NEUTRAL
2975,2975,Three-fold increase in insulin use http://bbc.in/1aypugi,three fold increase insulin use,NEUTRAL
2976,2976,Cancer 'envy' campaign criticised http://bbc.in/1kZbA8d,cancer envy campaign criticised,NEUTRAL
2977,2977,Temporary blindness 'boosts hearing' http://bbc.in/1kXOFda,temporary blindness boosts hearing,POSITIVE
2978,2978,VIDEO: Has Stafford scandal changed NHS? http://bbc.in/1itP32q,video has stafford scandal changed nhs,NEUTRAL
2979,2979,VIDEO: US chain to halt tobacco sales http://bbc.in/1g3VpTO,video us chain halt tobacco sales,NEUTRAL
2980,2980,CBT 'effective' in schizophrenia http://bbc.in/LRAGcF,cbt effective schizophrenia,NEUTRAL
2981,2981,Cash worries 'could harm NHS care' http://bbc.in/1itqtyx,cash worries could harm nhs care,NEGATIVE
2982,2982,Hospitals to log victims of FGM http://bbc.in/1irZXoI,hospitals log victims fgm,NEUTRAL
2983,2983,Bionic hand allows patient to 'feel' http://bbc.in/LQSp3Y,bionic hand allows patient feel,NEUTRAL
2984,2984,VIDEO: Health warning on NHS spending cuts http://bbc.in/1atwgUr,video health warning nhs spending cuts,NEGATIVE
2985,2985,VIDEO: Teen told he would die beating odds http://bbc.in/1epIQoS,video teen told would die beating odds,NEUTRAL
2986,2986,AUDIO: Shivering 'could cause weight loss' http://bbc.in/1irACvL,audio shivering could cause weight loss,NEUTRAL
2987,2987,VIDEO: NHS in England 'getting better' http://bbc.in/LOMXyI,video nhs england getting better,NEGATIVE
2988,2988,"NHS 'getting better', says Hunt http://bbc.in/1imRTp7",nhs getting better says hunt,NEGATIVE
2989,2989,New strain of 'deadly' bird flu http://bbc.in/1fZCtWi,new strain deadly bird flu,NEUTRAL
2990,2990,Data reveals England's fattest areas http://bbc.in/LMzUxz,data reveals england fattest areas,NEUTRAL
2991,2991,AUDIO: Sons on caring for dad with dementia http://bbc.in/1kM7QGU,audio sons caring dad dementia,NEUTRAL
2992,2992,AUDIO: Nutt: E-cigs are a 'health advance' http://bbc.in/LLS5DJ,audio nutt cigs health advance,NEUTRAL
2993,2993,Bug shuts hospital wards to visitors http://bbc.in/LLt0c0,bug shuts hospital wards visitors,NEUTRAL
2994,2994,'Delay' patient records database http://bbc.in/1ij1P31,delay patient records database,NEUTRAL
2995,2995,Cancer: A global threat http://bbc.in/1ij1P2T,cancer global threat,NEUTRAL
2996,2996,Play to Cure: Games for cancer http://bbc.in/LL2MGH,play cure games cancer,NEUTRAL
2997,2997,Councils 'pay too little for care' http://bbc.in/1kJUJpC,councils pay little care,NEUTRAL
2998,2998,VIDEO: Councils 'pay too little for home care' http://bbc.in/1fVPIYc,video councils pay little home care,NEUTRAL
2999,2999,"VIDEO: Cancer cases to soar, warns WHO http://bbc.in/1amLg6C",video cancer cases soar warns who,NEUTRAL
3000,3000,World facing cancer 'tidal wave' http://bbc.in/1kJ39h5,world facing cancer tidal wave,NEUTRAL
3001,3001,VIDEO: Drinking game page stops after death http://bbc.in/1kGqUGx,video drinking game page stops death,NEGATIVE
3002,3002,Four more E.coli cases linked to Hydro http://bbc.in/LHRPW8,four coli cases linked hydro,NEUTRAL
3003,3003,NHS sent users to malicious websites http://bbc.in/LHRPFP,nhs sent users malicious websites,NEGATIVE
3004,3004,Doctor prescribed 'elephant' dose http://bbc.in/1j6tozS,doctor prescribed elephant dose,NEUTRAL
3005,3005,AUDIO: Ex-drug user: addiction never leaves http://bbc.in/1aje3Jp,audio ex drug user addiction never leaves,NEUTRAL
3006,3006,AUDIO: Drinking game 'form of bullying' http://bbc.in/1ajdsYa,audio drinking game form bullying,NEGATIVE
3007,3007,VIDEO: Plastic surgery 'boom' in the UK http://bbc.in/1fRJoRp,video plastic surgery boom uk,NEUTRAL
3008,3008,Elderly breast cancer warning http://bbc.in/1fR4G1r,elderly breast cancer warning,NEGATIVE
3009,3009,VIDEO: Illegally tattooed at the age of 13 http://bbc.in/1fQRfhX,video illegally tattooed age,NEGATIVE
3010,3010,Vitamin pills 'lower exercise gains' http://bbc.in/LFgH0Z,vitamin pills lower exercise gains,NEUTRAL
3011,3011,'Tinnitus risk' of noisy nights out http://bbc.in/1kAUq0h,tinnitus risk noisy nights,NEUTRAL
3012,3012,'Pocket optician' trialled in schools http://bbc.in/1kAUnBM,pocket optician trialled schools,NEUTRAL
3013,3013,Plastic surgery 'booming' in the UK http://bbc.in/LFgElP,plastic surgery booming uk,NEUTRAL
3014,3014,Can couples really get stuck together during sex? http://bbc.in/LFgElK,can couples really get stuck together sex,NEUTRAL
3015,3015,Health watchdog attacks NHS culture http://bbc.in/1fMsrHW,health watchdog attacks nhs culture,NEUTRAL
3016,3016,VIDEO: NHS warned it 'could go bust' http://bbc.in/1i77sRy,video nhs warned could go bust,NEGATIVE
3017,3017,'We live with so many unknowns' http://bbc.in/1fKQp6u,we live many unknowns,NEUTRAL
3018,3018,VIDEO: Managing a month without alcohol http://bbc.in/1fIc13m,video managing month without alcohol,NEUTRAL
3019,3019,Dead eyes 'may give blind sight' http://bbc.in/1a9swaG,dead eyes may give blind sight,NEUTRAL
3020,3020,More NHS trusts sliding into the red http://bbc.in/1klSB7g,more nhs trusts sliding red,NEUTRAL
3021,3021,VIDEO: Cameron policies 'will lead to deaths' http://bbc.in/1kk9QpJ,video cameron policies lead deaths,NEUTRAL
3022,3022,AUDIO: Sally Roberts wanted 'best' for Neon http://bbc.in/1a6murb,audio sally roberts wanted best neon,NEGATIVE
3023,3023,Welsh drug testing can 'save lives' http://bbc.in/1hWMGUI,welsh drug testing save lives,MIXED
3024,3024,Inactivity 'pandemic' in poor areas http://bbc.in/1hWMEw4,inactivity pandemic poor areas,NEGATIVE
3025,3025,Vodka blamed for Russian death rate http://bbc.in/1iRzwMp,vodka blamed russian death rate,NEGATIVE
3026,3026,AUDIO: Orthorexia 'rules your entire life' http://bbc.in/1kdjmuy,audio orthorexia rules entire life,NEUTRAL
3027,3027,VIDEO: 'How I made stem cell breakthrough' http://bbc.in/1cyLWoG,video how made stem cell breakthrough,NEUTRAL
3028,3028,Eating disorders admissions up 8% http://bbc.in/Ls409q,eating disorders admissions,NEUTRAL
3029,3029,Schumacher's sedation 'reduced' http://bbc.in/LdfMnF,schumacher sedation reduced,POSITIVE
3030,3030,Why city life may be bad for you http://bbc.in/LqRmHQ,why city life may bad,NEGATIVE
3031,3031,Peanut allergy treatment 'a success' http://bbc.in/1hP77Tz,peanut allergy treatment success,NEUTRAL
3032,3032,Vitamins ‘effective in helping ADHD’ http://bbc.in/1hP75es,vitamins effective helping adhd,POSITIVE
3033,3033,Catching the mother of all bed bugs http://bbc.in/1cuJqQo,catching mother bed bugs,NEGATIVE
3034,3034,Stem cell 'major discovery' claimed http://bbc.in/1k6zApe,stem cell major discovery claimed,NEUTRAL
3035,3035,Child car smoking ban before Lords http://bbc.in/LmRZlJ,child car smoking ban lords,NEUTRAL
3036,3036,Over-90s ambulance trips 'up 81%' http://bbc.in/1ngKXO3,over ambulance trips,NEUTRAL
3037,3037,Multiple sclerosis link to food bug http://bbc.in/1ngKZoY,multiple sclerosis link food bug,NEUTRAL
3038,3038,Meeting Oxford's research monkeys http://bbc.in/Mak7IU,meeting oxford research monkeys,NEUTRAL
3039,3039,RVH major incident review announced http://bbc.in/1fttRXU,rvh major incident review announced,NEUTRAL
3040,3040,Ex-Stafford chief nurse 'struck off' http://bbc.in/1fttQD4,ex stafford chief nurse struck,NEUTRAL
3041,3041,Patient 'got hepatitis in hospital' http://bbc.in/1hIDL9m,patient got hepatitis hospital,NEUTRAL
3042,3042,Hospital petition handed to assembly http://bbc.in/1hIDJ1n,hospital petition handed assembly,NEUTRAL
3043,3043,Mental Health Act detentions up 12% http://bbc.in/1k0WKNT,mental health act detentions,NEUTRAL
3044,3044,'Kindness' worry in maternity survey http://bbc.in/1hIm1ek,kindness worry maternity survey,NEGATIVE
3045,3045,AUDIO: Research 'changing cancer treatment' http://bbc.in/Lj527T,audio research changing cancer treatment,NEUTRAL
3046,3046,Could bubonic plague strike again? http://bbc.in/1k0msC0,could bubonic plague strike,NEUTRAL
3047,3047,Custody healthcare a 'major problem' http://bbc.in/1k0mqdx,custody healthcare major problem,NEGATIVE
3048,3048,Care.data: Should we be concerned? http://bbc.in/LiRkln,care data should concerned,NEUTRAL
3049,3049,New calls to change sex education http://bbc.in/1k077l9,new calls change sex education,NEUTRAL
3050,3050,Suffering in silence http://bbc.in/1k077l6,suffering silence,NEUTRAL
3051,3051,Magnet rods straighten curved spines http://bbc.in/1jZfptx,magnet rods straighten curved spines,NEUTRAL
3052,3052,Pesticide linked to Alzheimer's http://bbc.in/1cny8gF,pesticide linked alzheimer,NEUTRAL
3053,3053,AUDIO: Girls' life expectancy over 100 http://bbc.in/1eaOHg2,audio girls life expectancy,NEUTRAL
3054,3054,Payout for girl's glue injection http://bbc.in/1jXbeON,payout girl glue injection,NEUTRAL
3055,3055,Routine ops resume in north Wales http://bbc.in/1jXbcX7,routine ops resume north wales,NEUTRAL
3056,3056,Parents admit baby's rickets death http://bbc.in/M3OtwF,parents admit baby rickets death,NEGATIVE
3057,3057,AUDIO: What is a 'musical hallucination'? http://bbc.in/1hDlDxu,audio what musical hallucination,POSITIVE
3058,3058,Liverpool Care Pathway 'wrongly blamed' http://bbc.in/1e9ioOu,liverpool care pathway wrongly blamed,NEGATIVE
3059,3059,Cancer care praise but issues remain http://bbc.in/1e9ioye,cancer care praise issues remain,NEUTRAL
3060,3060,Music therapy 'helps cancer young' http://bbc.in/1cjCJR0,music therapy helps cancer young,NEUTRAL
3061,3061,Pregnant woman's life support ended http://bbc.in/1jU4xgx,pregnant woman life support ended,NEUTRAL
3062,3062,VIDEO: E-cigarette ban for under-18s http://bbc.in/1fn55IT,video cigarette ban,NEUTRAL
3063,3063,E-cigarette ban for under-18s http://bbc.in/1jQJF9V,cigarette ban,NEUTRAL
3064,3064,VIDEO: Social media campaign to help toddler http://bbc.in/1ce2br9,video social media campaign help toddler,NEUTRAL
3065,3065,Drugs take-up 'should be higher' http://bbc.in/1cdflEQ,drugs take higher,NEUTRAL
3066,3066,Pregnancy fat 'may alter baby brain' http://bbc.in/1e2ZCZh,pregnancy fat may alter baby brain,NEUTRAL
3067,3067,The stethoscope: are its days numbered? http://bbc.in/1jIOL7W,the stethoscope days numbered,NEUTRAL
3068,3068,Older cancer patients 'written off' http://bbc.in/KRrAMG,older cancer patients written,NEUTRAL
3069,3069,'No point in vitamin D for healthy' http://bbc.in/1dZM9Bo,no point vitamin healthy,NEGATIVE
3070,3070,Babies' heart risk 'shaped early on' http://bbc.in/1dZM9Bk,babies heart risk shaped early,NEUTRAL
3071,3071,"Dog cancer 'dates back 11,000 years' http://bbc.in/1c7HZHb",dog cancer dates back years,NEUTRAL
3072,3072,NI boy diagnosed with swine flu http://bbc.in/1iqNF2M,ni boy diagnosed swine flu,NEUTRAL
3073,3073,Deadly bird flu cases surging http://bbc.in/1mKCMt1,deadly bird flu cases surging,NEUTRAL
3074,3074,VIDEO: OECD: Employers must address stress http://bbc.in/1cYu2Y7,video oecd employers must address stress,NEUTRAL
3075,3075,'Missed opportunities' in boy's care http://bbc.in/1ipYvGk,missed opportunities boy care,NEUTRAL
3076,3076,NHS waiting time data 'unreliable' http://bbc.in/1cXIaR6,nhs waiting time data unreliable,NEGATIVE
3077,3077,Central heating 'may make you fat' http://bbc.in/1cXp79O,central heating may make fat,NEGATIVE
3078,3078,Doubts cast on UK heart-attack care http://bbc.in/1ip0OcK,doubts cast uk heart attack care,NEGATIVE
3079,3079,VIDEO: Brand: 'Drugs legal within 20 years' http://bbc.in/1cWZmGo,video brand drugs legal within years,NEUTRAL
3080,3080,VIDEO: 'Tougher clean air targets needed' http://bbc.in/1bZv4qQ,video tougher clean air targets needed,NEUTRAL
3081,3081,Baby unit closure 'must not happen' http://bbc.in/1hhDgTs,baby unit closure must happen,NEGATIVE
3082,3082,Head space: 3D surgery in the brain http://bbc.in/1mEz7wN,head space surgery brain,NEUTRAL
3083,3083,Magnets 'can treat some migraines' http://bbc.in/1hgnice,magnets treat migraines,MIXED
3084,3084,Obesity measure 'too high' for many http://bbc.in/1mDdKfk,obesity measure high many,NEUTRAL
3085,3085,EU pollution target 'still too high' http://bbc.in/1hgnkkk,eu pollution target still high,NEGATIVE
3086,3086,Call for safe staff levels across NHS http://bbc.in/1mDdHAf,call safe staff levels across nhs,NEUTRAL
3087,3087,Breast implant damages ruling upheld http://bbc.in/LBNBiJ,breast implant damages ruling upheld,MIXED
3088,3088,AUDIO: 'I feel right to die pressure' http://bbc.in/1cQVN4O,audio feel right die pressure,POSITIVE
3089,3089,Death doctor sues victim's son http://bbc.in/1cQVN4E,death doctor sues victim son,NEUTRAL
3090,3090,Cancer patients 'to double by 2030' http://bbc.in/1helOiA,cancer patients double,NEUTRAL
3091,3091,Routine ops in north Wales postponed http://bbc.in/1bPcn9m,routine ops north wales postponed,NEUTRAL
3092,3092,Grieving mother's NHS baby care plea http://bbc.in/KymAfP,grieving mother nhs baby care plea,NEUTRAL
3093,3093,AUDIO: 'I am facing Hayley's choice' http://bbc.in/1jtHA3y,audio facing hayley choice,NEUTRAL
3094,3094,Failing elderly care home to close http://bbc.in/1mzNvX7,failing elderly care home close,NEGATIVE
3095,3095,Savile links with NHS home probed http://bbc.in/1mzNvGL,savile links nhs home probed,NEUTRAL
3096,3096,AUDIO: Night shift work causes body 'chaos' http://bbc.in/1ij3ubY,audio night shift work causes body chaos,NEUTRAL
3097,3097,Health service to receive extra £30m http://bbc.in/1ij3ubP,health service receive extra,POSITIVE
3098,3098,Critics hail Hayley's Corrie exit http://bbc.in/Kx7zuC,critics hail hayley corrie exit,NEUTRAL
3099,3099,Donations soar for Steve Evans fund http://bbc.in/1myVd3M,donations soar steve evans fund,NEUTRAL
