,Unnamed: 0,tweets,clean_text,Sentiment
1434,1434,VIDEO: US: Ebola 'threat to global security' http://bbc.in/1n1EdHd,video us ebola threat global security,NEUTRAL
1435,1435,VIDEO: Can your skirt size be a cancer clue? http://bbc.in/1mXNdgr,video can skirt size cancer clue,NEUTRAL
1436,1436,Sierra Leone widens Ebola quarantine http://bbc.in/1CmIwQI,sierra leone widens ebola quarantine,NEUTRAL
1437,1437,VIDEO: Brazil releases 'good' mosquitoes http://bbc.in/1xkRRIE,video brazil releases good mosquitoes,POSITIVE
1438,1438,In pictures: Mali’s motorbiking eye surgeons http://bbc.in/1CjQWs2,in pictures malis motorbiking eye surgeons,NEUTRAL
1439,1439,AUDIO: 'I lost ten family members to Ebola' http://bbc.in/1uod3fA,audio lost ten family members ebola,NEGATIVE
1440,1440,VIDEO: Tears at 91-year-old's NHS plea http://bbc.in/1ChIObl,video tears year old nhs plea,NEUTRAL
1441,1441,Ebola nations may 'face collapse' http://bbc.in/1un8LFr,ebola nations may face collapse,NEUTRAL
1442,1442,Breath test for TB developed http://bbc.in/1soRVGf,breath test tb developed,NEUTRAL
1443,1443,Labour to set out plan to 'save' NHS http://bbc.in/1ulxQRc,labour set plan save nhs,NEUTRAL
1444,1444,The struggle to claim the month of October http://bbc.in/1uihhpd,the struggle claim month october,NEUTRAL
1445,1445,VIDEO: NHS staff to help in Ebola areas http://bbc.in/1uhhZmx,video nhs staff help ebola areas,NEUTRAL
1446,1446,NHS staff volunteer for Ebola effort http://bbc.in/1ugMU2k,nhs staff volunteer ebola effort,NEUTRAL
1447,1447,OAPs offered online hospital checks http://bbc.in/1C8OWCL,oaps offered online hospital checks,NEUTRAL
1448,1448,VIDEO: Teenagers shy to talk about cancer http://bbc.in/XRP7mH,video teenagers shy talk cancer,NEUTRAL
1449,1449,VIDEO: Sharp rise in Malaysia dengue deaths http://bbc.in/1uf7PTw,video sharp rise malaysia dengue deaths,NEUTRAL
1450,1450,Children 'failed in early years' http://bbc.in/XYCmqF,children failed early years,NEGATIVE
1451,1451,"Go TV-free to fight fat, says NICE http://bbc.in/1x39EUu",go tv free fight fat says nice,POSITIVE
1452,1452,Call to offer boys the HPV vaccine http://bbc.in/XIJtTF,call offer boys hpv vaccine,NEUTRAL
1453,1453,NHS whistleblowing 'problems persist' http://bbc.in/XIJsis,nhs whistleblowing problems persist,NEGATIVE
1454,1454,Roast peanuts 'spark more allergies' http://bbc.in/1sTxZ8w,roast peanuts spark allergies,NEUTRAL
1455,1455,VIDEO: Are disability hate crimes ignored? http://bbc.in/1tKILlM,video are disability hate crimes ignored,NEGATIVE
1456,1456,VIDEO: Inside London hospital's 'eye bank' http://bbc.in/1mu7qKr,video inside london hospital eye bank,NEUTRAL
1457,1457,"From toilet to table, overcoming the ‘yuk’ factor http://bbc.in/1sdiMox",from toilet table overcoming yuk factor,NEUTRAL
1458,1458,How Liberia lost its handshake http://bbc.in/1wTnusH,how liberia lost handshake,NEUTRAL
1459,1459,VIDEO: Asthma stigma in some Asian families http://bbc.in/1tDfppj,video asthma stigma asian families,NEUTRAL
1460,1460,Why I'll risk my life for Ebola patients http://bbc.in/Xxt8Bg,why risk life ebola patients,NEUTRAL
1461,1461,Pregnancy hormone link to poor maths http://bbc.in/1wMlDFZ,pregnancy hormone link poor maths,NEUTRAL
1462,1462,Ebola health team killed in Guinea http://bbc.in/1BT2YIK,ebola health team killed guinea,NEUTRAL
1463,1463,VIDEO: Ebola warning 'a wake-up call' http://bbc.in/1wLWYRT,video ebola warning wake call,NEUTRAL
1464,1464,Cancer test 'Jolie effect' found http://bbc.in/1mi205o,cancer test jolie effect found,POSITIVE
1465,1465,Health services finances 'worsening' http://bbc.in/1mhWRu6,health services finances worsening,NEGATIVE
1466,1466,VIDEO: Ambulance death woman 'let down' http://bbc.in/1wJoteZ,video ambulance death woman let,NEUTRAL
1467,1467,NHS staff vote for strike action http://bbc.in/1wHDePd,nhs staff vote strike action,NEUTRAL
1468,1468,Family criticise trust over death http://bbc.in/1wshFPV,family criticise trust death,NEGATIVE
1469,1469,Obesity the new smoking - NHS boss http://bbc.in/Xndg4b,obesity new smoking nhs boss,NEUTRAL
1470,1470,Woman's ambulance queue death review http://bbc.in/1uJzGtN,woman ambulance queue death review,NEGATIVE
1471,1471,Berries in cancer therapy trial http://bbc.in/1wr82Ru,berries cancer therapy trial,NEUTRAL
1472,1472,Green light for new skin cancer drug http://bbc.in/1tiWtfr,green light new skin cancer drug,NEUTRAL
1473,1473,VIDEO: Ebola: The scale of the challenge http://bbc.in/1yhQ7Bi,video ebola the scale challenge,NEUTRAL
1474,1474,Ebola trial volunteer immunised http://bbc.in/1souxma,ebola trial volunteer immunised,NEUTRAL
1475,1475,Ebola: The hunt for a vaccine http://bbc.in/1ygWp4i,ebola the hunt vaccine,NEUTRAL
1476,1476,VIDEO: Playgrounds for senior citizens http://bbc.in/1wCRTev,video playgrounds senior citizens,NEUTRAL
1477,1477,VIDEO: Should 'vaping bars' be banned? http://bbc.in/1tcxfiG,video should vaping bars banned,NEGATIVE
1478,1478,Ebola vaccine trial begins http://bbc.in/1slAmAF,ebola vaccine trial begins,NEUTRAL
1479,1479,US waists 'grow an inch in a decade' http://bbc.in/1oY1V2a,us waists grow inch decade,NEUTRAL
1480,1480,The plight of Moldova's orphanage children http://bbc.in/1uERkyG,the plight moldova orphanage children,NEUTRAL
1481,1481,Ebola global security threat - Obama http://bbc.in/1ydxvma,ebola global security threat obama,NEUTRAL
1482,1482,"Local hospitals ""can be gold standard"" http://bbc.in/1sgHdvl",local hospitals gold standard,NEUTRAL
1483,1483,UN calls for $1bn to fight Ebola http://bbc.in/1uD6KU8,un calls bn fight ebola,NEUTRAL
1484,1484,AUDIO: 'New solution' on polio being tested http://bbc.in/XbBrCv,audio new solution polio tested,NEUTRAL
1485,1485,VIDEO: Further cut to sugar intake needed http://bbc.in/1sfvNrP,video further cut sugar intake needed,NEUTRAL
1486,1486,Stephen's £5m to fund cancer units http://bbc.in/1seZmtx,stephen fund cancer units,NEUTRAL
1487,1487,VIDEO: 'I just couldn't bear it anymore' http://bbc.in/1uCvuf4,video bear anymore,NEUTRAL
1488,1488,VIDEO: Stephen Sutton's £5m charity legacy http://bbc.in/1oTukWW,video stephen sutton charity legacy,NEUTRAL
1489,1489,VIDEO: Haiti's disease fighting eco toilet http://bbc.in/1oTeFXH,video haiti disease fighting eco toilet,NEUTRAL
1490,1490,VIDEO: UN security council to discuss Ebola http://bbc.in/1sdE0g2,video un security council discuss ebola,NEUTRAL
1491,1491,Call for further cut in sugar intake http://bbc.in/1uBMYIH,call cut sugar intake,NEUTRAL
1492,1492,Rugby players 'risk skin infections' http://bbc.in/1scOpIO,rugby players risk skin infections,NEUTRAL
1493,1493,Ashya proton beam sessions begin http://bbc.in/1wwylsn,ashya proton beam sessions begin,NEUTRAL
1494,1494,Child heart surgery views sought http://bbc.in/1oPWvpI,child heart surgery views sought,NEUTRAL
1495,1495,Doctor abused child cancer patients http://bbc.in/1s966ZG,doctor abused child cancer patients,NEGATIVE
1496,1496,VIDEO: Does driving make you worse at work? http://bbc.in/1sVkoBs,video does driving make worse work,NEGATIVE
1497,1497,VIDEO: Mers: Camel traders unalarmed by virus http://bbc.in/1oNsy9Y,video mers camel traders unalarmed virus,NEGATIVE
1498,1498,Mers: Saudis in push to keep Hajj free from deadly virus http://bbc.in/1sUAnj8,mers saudis push keep hajj free deadly virus,NEUTRAL
1499,1499,Walking or cycling 'wellbeing boost' http://bbc.in/X41dIU,walking cycling wellbeing boost,POSITIVE
1500,1500,Brains may 'resist Alzheimer's' http://bbc.in/1sRYcrS,brains may resist alzheimer,NEUTRAL
1501,1501,Social care access 'limited for many' http://bbc.in/1s1V60i,social care access limited many,NEGATIVE
1502,1502,Suspended between life and death http://bbc.in/1sMSQOy,suspended life death,NEGATIVE
1503,1503,Botox 'stunts emotional growth' http://bbc.in/1oEpSve,botox stunts emotional growth,NEUTRAL
1504,1504,Trade talks 'should include health' http://bbc.in/1oEpVah,trade talks include health,NEUTRAL
1505,1505,Mum and daughter give dyspraxia help http://bbc.in/1usUDJ8,mum daughter give dyspraxia help,NEUTRAL
1506,1506,Police investigating baby feed deaths http://bbc.in/1sBXe2L,police investigating baby feed deaths,NEUTRAL
1507,1507,Nicotine device 'medically approved' http://bbc.in/WSWlX5,nicotine device medically approved,NEUTRAL
1508,1508,Cuba to send doctors to Ebola areas http://bbc.in/WSclsn,cuba send doctors ebola areas,NEUTRAL
1509,1509,Brain 'still active during sleep' http://bbc.in/1sw7eur,brain still active sleep,NEUTRAL
1510,1510,VIDEO: UK Ebola survivor returns to Africa http://bbc.in/1rPPNB8,video uk ebola survivor returns africa,NEUTRAL
1511,1511,VIDEO: Campaigns in debate clash over NHS http://bbc.in/1oyUo9F,video campaigns debate clash nhs,NEUTRAL
1512,1512,Ashya hospital staff 'receive abuse' http://bbc.in/1owXn2u,ashya hospital staff receive abuse,NEGATIVE
1513,1513,Fat shaming 'leads to weight gain' http://bbc.in/1srkMr6,fat shaming leads weight gain,NEUTRAL
1514,1514,Call for lung cancer screening in UK http://bbc.in/1so8jEu,call lung cancer screening uk,NEUTRAL
1515,1515,Blood group 'link to memory loss' http://bbc.in/1p9gE9m,blood group link memory loss,NEUTRAL
1516,1516,AUDIO: Can you die from a broken heart? http://bbc.in/1umhUMX,audio can die broken heart,NEGATIVE
1517,1517,AUDIO: 'I woke up during surgery' http://bbc.in/1skvKP9,audio woke surgery,NEUTRAL
1518,1518,New money to tackle Ebola outbreak http://bbc.in/1osYj7Y,new money tackle ebola outbreak,NEUTRAL
1519,1519,VIDEO: What is the best way to brush teeth? http://bbc.in/1skio5j,video what best way brush teeth,POSITIVE
1520,1520,Two more nurses on neglect charges http://bbc.in/1rGzS7V,two nurses neglect charges,NEUTRAL
1521,1521,Some patients 'awake' during surgery http://bbc.in/1rFwkTw,some patients awake surgery,NEUTRAL
1522,1522,Ebola 'threat to Liberia existence' http://bbc.in/WHAula,ebola threat liberia existence,NEUTRAL
1523,1523,VIDEO: Dementia patients 'face care tax' http://bbc.in/WH9Bhk,video dementia patients face care tax,NEUTRAL
1524,1524,Sleeping pills 'linked to dementia' http://bbc.in/1p56K91,sleeping pills linked dementia,NEUTRAL
1525,1525,Dementia patients 'face care tax' http://bbc.in/1rDOqW0,dementia patients face care tax,NEUTRAL
1526,1526,Ashya undergoes Prague clinic scans http://bbc.in/1wb7m5r,ashya undergoes prague clinic scans,NEUTRAL
1527,1527,VIDEO: 'Society must recognise mental ill health' http://bbc.in/1uhkdkr,video society must recognise mental ill health,NEUTRAL
1528,1528,VIDEO: 'Make mental health bigger priority' http://bbc.in/1uhfK0Z,video make mental health bigger priority,NEUTRAL
1529,1529,E-cigs refills 'threat to children' http://bbc.in/1w9dGdv,cigs refills threat children,NEGATIVE
1530,1530,Make mental health 'bigger priority' http://bbc.in/1w9dGdu,make mental health bigger priority,MIXED
1531,1531,VIDEO: NHS focus of 'Yes' and 'No' campaigns http://bbc.in/1s5MSIp,video nhs focus yes no campaigns,NEUTRAL
1532,1532,Liberia 'faces huge Ebola surge' http://bbc.in/1xyWWOG,liberia faces huge ebola surge,NEUTRAL
1533,1533,Hundreds of US children hit by virus http://bbc.in/1w7YHR9,hundreds us children hit virus,NEGATIVE
1534,1534,British military sent to fight Ebola http://bbc.in/1ruJRNu,british military sent fight ebola,NEUTRAL
1535,1535,VIDEO: Girl who had proton beam therapy http://bbc.in/1s1cBBG,video girl proton beam therapy,NEUTRAL
1536,1536,NHS cancer services 'struggling' http://bbc.in/1oXw5BF,nhs cancer services struggling,NEGATIVE
1537,1537,Ashya King leaves Malaga hospital http://bbc.in/Wx85OF,ashya king leaves malaga hospital,NEUTRAL
1538,1538,VIDEO: Ashya King 'to travel to Prague' http://bbc.in/1rZEkCD,video ashya king travel prague,NEUTRAL
1539,1539,VIDEO: The machine that could help Ashya http://bbc.in/1xwg7Zk,video the machine could help ashya,NEUTRAL
1540,1540,Sibling bullying ups depression risk http://bbc.in/1rYWapq,sibling bullying ups depression risk,NEGATIVE
1541,1541,The pro cycling team with diabetes http://bbc.in/1rrwZYB,the pro cycling team diabetes,NEUTRAL
1542,1542,Ashya King 'to leave hospital' http://bbc.in/1rWKEuM,ashya king leave hospital,NEUTRAL
1543,1543,Vaccine gives monkeys Ebola immunity http://bbc.in/1rVS0yF,vaccine gives monkeys ebola immunity,NEUTRAL
1544,1544,Deadly disease v untested treatment http://bbc.in/1rRK3KO,deadly disease untested treatment,MIXED
1545,1545,Ebola lockdown will not help - MSF http://bbc.in/1w2sKtx,ebola lockdown help msf,NEUTRAL
1546,1546,VIDEO: Parents 'emotional' as deaf baby hears http://bbc.in/1xnbXmt,video parents emotional deaf baby hears,NEUTRAL
1547,1547,VIDEO: March for NHS heads to Westminster http://bbc.in/1rPu3sB,video march nhs heads westminster,NEUTRAL
1548,1548,VIDEO: Sierra Leone declares Ebola lockdown http://bbc.in/1xpbro2,video sierra leone declares ebola lockdown,NEUTRAL
1549,1549,Ashya ready for Prague treatment http://bbc.in/1u8YpqQ,ashya ready prague treatment,NEUTRAL
1550,1550,Sierra Leone declares Ebola lockdown http://bbc.in/WnTKnw,sierra leone declares ebola lockdown,NEUTRAL
1551,1551,Ebola: How bad can it get? http://bbc.in/1o8K5Jm,ebola how bad get,NEGATIVE
1552,1552,Ashya allowed to fly to Prague http://bbc.in/1rHFmTU,ashya allowed fly prague,NEUTRAL
1553,1553,Use Ebola survivors' blood - WHO http://bbc.in/1xlwjg7,use ebola survivors blood who,NEUTRAL
1554,1554,Coca-Cola to adopt UK health labels http://bbc.in/1rFCnv8,coca cola adopt uk health labels,NEUTRAL
1555,1555,VIDEO: WHO meeting to discuss Ebola therapy http://bbc.in/1vUWloE,video who meeting discuss ebola therapy,NEUTRAL
1556,1556,Fast-paced TV 'no bad behaviour link' http://bbc.in/Wikgie,fast paced tv bad behaviour link,NEGATIVE
1557,1557,One in five child deaths 'preventable' http://bbc.in/1rAPLRb,one five child deaths preventable,NEUTRAL
1558,1558,E-cigarette criticisms 'alarmist' http://bbc.in/1oJT3Ml,cigarette criticisms alarmist,NEGATIVE
1559,1559,Third American with Ebola named http://bbc.in/1rye3LE,third american ebola named,NEUTRAL
1560,1560,Suicide death 'every 40 seconds' http://bbc.in/1xflgF1,suicide death every seconds,NEGATIVE
1561,1561,"Ebola death toll exceeds 1,900 http://bbc.in/1vQKtnw",ebola death toll exceeds,NEUTRAL
1562,1562,Call to end NHS-social care divide http://bbc.in/1xcXI3B,call end nhs social care divide,NEUTRAL
1563,1563,IVF treatment on NHS 'needs reform' http://bbc.in/1roSxJ9,ivf treatment nhs needs reform,NEUTRAL
1564,1564,VIDEO: Inside hospital welcoming maggots http://bbc.in/1ro4vmo,video inside hospital welcoming maggots,NEUTRAL
1565,1565,VIDEO: Doctor describes Ashya King treatment http://bbc.in/1rnL9h0,video doctor describes ashya king treatment,NEUTRAL
1566,1566,VIDEO: Ebola patient on his lowest point http://bbc.in/1tZVTmM,video ebola patient lowest point,NEUTRAL
1567,1567,British Ebola patient 'discharged' http://bbc.in/1r0xRDh,british ebola patient discharged,NEUTRAL
1568,1568,Ashya's mother 'cried and prayed' http://bbc.in/1uyGZ5j,ashya mother cried prayed,NEUTRAL
1569,1569,Ashya's parents freed from prison http://bbc.in/1x9Gx2M,ashya parents freed prison,NEUTRAL
1570,1570,All diets 'have similar results' http://bbc.in/1ri8Lnf,all diets similar results,NEUTRAL
1571,1571,House the elderly on NHS land - MP http://bbc.in/1qZ8IsB,house elderly nhs land mp,NEUTRAL
1572,1572,Allergy mistakes 'risking lives' http://bbc.in/1ri8Nf4,allergy mistakes risking lives,NEGATIVE
1573,1573,Ebola response 'lethally inadequate' http://bbc.in/1qXREDr,ebola response lethally inadequate,NEGATIVE
1574,1574,Ashya situation not right - police http://bbc.in/1nuLQ3p,ashya situation right police,NEUTRAL
1575,1575,Ebola 'threatens' W Africa harvests http://bbc.in/1nsSkzU,ebola threatens africa harvests,NEUTRAL
1576,1576,Brain 'can learn to eat healthily' http://bbc.in/1raMEPG,brain learn eat healthily,NEUTRAL
1577,1577,Action films 'may make you fat' http://bbc.in/1r7OMYu,action films may make fat,NEGATIVE
1578,1578,Hospitals seeing more skin cancer http://bbc.in/W4w1J0,hospitals seeing skin cancer,NEUTRAL
1579,1579,VIDEO: 'Bacon butty' for British Ebola nurse http://bbc.in/1u9K38Z,video bacon butty british ebola nurse,NEUTRAL
1580,1580,VIDEO: Proton therapy: UK patient access http://bbc.in/W3IFYM,video proton therapy uk patient access,NEUTRAL
1581,1581,British Ebola patient 'pretty well' http://bbc.in/1u9nP6R,british ebola patient pretty well,POSITIVE
1582,1582,Ashya parents contest extradition http://bbc.in/1x0UJuX,ashya parents contest extradition,NEUTRAL
1583,1583,Sniffing faeces 'detects infection' http://bbc.in/1r2XEOS,sniffing faeces detects infection,NEUTRAL
1584,1584,The girl with three biological parents http://bbc.in/1qT0Qc2,the girl three biological parents,NEUTRAL
1585,1585,What is proton beam therapy? http://bbc.in/1qSwSoN,what proton beam therapy,NEUTRAL
1586,1586,'No apology' over Ashya response http://bbc.in/1qS2gDO,no apology ashya response,NEUTRAL
1587,1587,VIDEO: Urgent calls to tackle childhood obesity http://bbc.in/1vzpwxv,video urgent calls tackle childhood obesity,NEUTRAL
1588,1588,Childhood obesity taskforce 'urgent' http://bbc.in/1qR2GtX,childhood obesity taskforce urgent,NEUTRAL
1589,1589,Bionic pancreas: A new dawn for diabetics? http://bbc.in/VYE6iv,bionic pancreas new dawn diabetics,NEUTRAL
1590,1590,Test Ebola drug '100% effective' http://bbc.in/1vufM7F,test ebola drug effective,NEUTRAL
1591,1591,Senegal confirms first Ebola case http://bbc.in/1tKaEKo,senegal confirms first ebola case,NEUTRAL
1592,1592,"Post-natal care lacking, say midwives http://bbc.in/VVp7FT",post natal care lacking say midwives,NEUTRAL
1593,1593,"Hunt for boy, 5, snatched from ward http://bbc.in/1sNp9dQ",hunt boy snatched ward,NEUTRAL
1594,1594,Electrical stimulation 'aids memory' http://bbc.in/1sLte25,electrical stimulation aids memory,POSITIVE
1595,1595,Plain packs 'no effect on smokers' http://bbc.in/1vrCoW8,plain packs effect smokers,NEGATIVE
1596,1596,New hospital food rules introduced http://bbc.in/1vrs8gR,new hospital food rules introduced,NEUTRAL
1597,1597,Genetic clues to spread of Ebola http://bbc.in/1qFoWLh,genetic clues spread ebola,NEUTRAL
1598,1598,UK Ebola vaccine trial to start http://bbc.in/1wHeWWu,uk ebola vaccine trial start,NEUTRAL
1599,1599,Ebola spreads to Nigeria oil hub http://bbc.in/1sGYoHQ,ebola spreads nigeria oil hub,NEUTRAL
1600,1600,NHS complaints rise to 480 every day http://bbc.in/1zJsZau,nhs complaints rise every day,MIXED
1601,1601,Ex dental prof loses dismissal claim http://bbc.in/1sG0NTf,ex dental prof loses dismissal claim,NEUTRAL
1602,1602,Ebola outbreak 'will get worse' http://bbc.in/1nFOHX3,ebola outbreak get worse,NEGATIVE
1603,1603,Depression in cancer 'overlooked' http://bbc.in/1wF9pjp,depression cancer overlooked,NEGATIVE
1604,1604,Cancer drugs face NHS price squeeze http://bbc.in/1sDKIgL,cancer drugs face nhs price squeeze,NEUTRAL
1605,1605,Tomatoes linked with fighting cancer http://bbc.in/1qwRne2,tomatoes linked fighting cancer,NEUTRAL
1606,1606,Nigeria closes schools over Ebola http://bbc.in/1vlI6Jg,nigeria closes schools ebola,NEUTRAL
1607,1607,Sniffing out the allergy epidemic http://bbc.in/1qt0MmX,sniffing allergy epidemic,NEGATIVE
1608,1608,Overseas nurses 'face shorter tests' http://bbc.in/1syea7O,overseas nurses face shorter tests,NEUTRAL
1609,1609,Ebola crisis: Five top tips to avoid the deadly virus http://bbc.in/1tBa1mq,ebola crisis five top tips avoid deadly virus,NEUTRAL
1610,1610,Hormone 'protects premature babies' http://bbc.in/1tB4BYz,hormone protects premature babies,NEUTRAL
1611,1611,'UK Ebola nurse gets test drug' http://bbc.in/1sw0b2z,uk ebola nurse gets test drug,NEUTRAL
1612,1612,VIDEO: What goes into a fake cigarette? http://bbc.in/1ny0dng,video what goes fake cigarette,NEGATIVE
1613,1613,Ebola: 'heavy toll' on health staff http://bbc.in/1zxQbbo,ebola heavy toll health staff,NEUTRAL
1614,1614,"'Ban E-cig use indoors,' says WHO http://bbc.in/1nxm2DB",ban cig use indoors says who,NEUTRAL
1615,1615,Ebola doctor goes back to work http://bbc.in/1vhYZVj,ebola doctor goes back work,NEUTRAL
1616,1616,Gut bugs 'help prevent allergies' http://bbc.in/1ty9qSw,gut bugs help prevent allergies,POSITIVE
1617,1617,Briton begins UK treatment for Ebola http://bbc.in/1qeMJRV,briton begins uk treatment ebola,NEUTRAL
1618,1618,Whole organ 'grown' in world first http://bbc.in/1skMS4T,whole organ grown world first,NEUTRAL
1619,1619,British Ebola patient to fly to UK http://bbc.in/1nq0yIO,british ebola patient fly uk,NEUTRAL
1620,1620,VIDEO: Cellist: 'Alcohol was my medicine' http://bbc.in/1sjcxej,video cellist alcohol medicine,NEUTRAL
1621,1621,Ebola risk to UK remains 'very low' http://bbc.in/1si6nuW,ebola risk uk remains low,NEUTRAL
1622,1622,The malaria mines of Venezuela http://bbc.in/YOHO08,the malaria mines venezuela,NEGATIVE
1623,1623,Briton in Sierra Leone 'has Ebola' http://bbc.in/1q7gggp,briton sierra leone ebola,NEUTRAL
1624,1624,Disk of patient records 'missing' http://bbc.in/1vvIBh3,disk patient records missing,NEGATIVE
1625,1625,VIDEO: Stroke clot drug in safety review http://bbc.in/1q5p71Z,video stroke clot drug safety review,NEUTRAL
1626,1626,Hospitals told to cut parking charges http://bbc.in/1scZQl4,hospitals told cut parking charges,NEUTRAL
1627,1627,VIDEO: Rapid 'doctor's assistant' expansion http://bbc.in/1q2UASw,video rapid doctor assistant expansion,NEUTRAL
1628,1628,Experts to review stroke clot-buster http://bbc.in/1q2ny4O,experts review stroke clot buster,NEUTRAL
1629,1629,Salmonella 'from single egg source' http://bbc.in/1sb53tL,salmonella single egg source,NEUTRAL
1630,1630,Irishman did not have Ebola virus http://bbc.in/YI8b7O,irishman ebola virus,NEUTRAL
1631,1631,Rapid 'doctor's assistant' expansion http://bbc.in/YI8bES,rapid doctor assistant expansion,NEUTRAL
1632,1632,VIDEO: Malnutrition up as food prices rise http://bbc.in/YHfzjG,video malnutrition food prices rise,NEGATIVE
1633,1633,Health experts' food poverty warning http://bbc.in/1vp6oiP,health experts food poverty warning,NEUTRAL
1634,1634,Doctors may face 'tougher sanctions' http://bbc.in/1z8Ufi7,doctors may face tougher sanctions,NEUTRAL
1635,1635,Double vaccines 'could end polio' http://bbc.in/1pX5Uzv,double vaccines could end polio,NEUTRAL
1636,1636,VIDEO: Possible Ebola case in Ireland http://bbc.in/1pVMBGR,video possible ebola case ireland,NEUTRAL
1637,1637,Dawkins: Abort Down's foetuses http://bbc.in/YEmVEG,dawkins abort down foetuses,NEUTRAL
1638,1638,US Ebola cases discharged by medics http://bbc.in/1s4Moj1,us ebola cases discharged medics,NEUTRAL
1639,1639,Trauma warning on Foley death video http://bbc.in/1v0OCVx,trauma warning foley death video,NEUTRAL
1640,1640,Shots fired at Liberia Ebola protest http://bbc.in/1v0C808,shots fired liberia ebola protest,NEUTRAL
1641,1641,NI cuts would risk 'patient safety' http://bbc.in/1vlaB6Z,ni cuts would risk patient safety,NEGATIVE
1642,1642,VIDEO: One Briton a fortnight helped to die http://bbc.in/YD1vrr,video one briton fortnight helped die,NEUTRAL
1643,1643,One Briton a fortnight helped to die http://bbc.in/1z50V0X,one briton fortnight helped die,NEUTRAL
1644,1644,Labour in energy regulator pledge http://bbc.in/1z3sOGo,labour energy regulator pledge,NEUTRAL
1645,1645,Superbug measures 'lack evidence' http://bbc.in/1z3sOq7,superbug measures lack evidence,NEGATIVE
1646,1646,Botox may have cancer fighting role http://bbc.in/1pQbhR7,botox may cancer fighting role,NEUTRAL
1647,1647,Liberia troops enforce quarantine http://bbc.in/1vibm0y,liberia troops enforce quarantine,NEUTRAL
1648,1648,Thousands 'eligible for Ebola drugs' http://bbc.in/1uXcoBO,thousands eligible ebola drugs,NEUTRAL
1649,1649,Sepsis: Antibiotics 'not working' http://bbc.in/1vhJFoM,sepsis antibiotics working,NEGATIVE
1650,1650,Life on Ebola front line http://bbc.in/1pMmUIH,life ebola front line,NEUTRAL
1651,1651,Student in lifesaving heart finding http://bbc.in/1rXSWA3,student lifesaving heart finding,POSITIVE
1652,1652,Hospital hack 'exploited Heartbleed' http://bbc.in/1rXSUrN,hospital hack exploited heartbleed,NEGATIVE
1653,1653,Heart deaths reach 'tipping point' http://bbc.in/1n9j1ZU,heart deaths reach tipping point,NEUTRAL
1654,1654,Children's hospital 'must improve' http://bbc.in/1uVeQsu,children hospital must improve,MIXED
1655,1655,Mental health care 'in dark ages' http://bbc.in/YwYwB0,mental health care dark ages,NEUTRAL
1656,1656,'More' private hospital data needed http://bbc.in/1rVvTpw,more private hospital data needed,NEUTRAL
1657,1657,'Nurse ratio' key to stroke survival http://bbc.in/1rTHTHW,nurse ratio key stroke survival,NEUTRAL
1658,1658,Liberian Ebola patients 'found' http://bbc.in/1vc79vm,liberian ebola patients found,NEUTRAL
1659,1659,Brain stimulation 'helps in stroke' http://bbc.in/1yT1nz6,brain stimulation helps stroke,NEUTRAL
1660,1660,VIDEO: The debate over competition in the NHS http://bbc.in/1rP5Mk0,video the debate competition nhs,NEUTRAL
1661,1661,VIDEO: Inside Liberia Ebola treatment centre http://bbc.in/1rP41TQ,video inside liberia ebola treatment centre,NEUTRAL
1662,1662,Pill 'reduces hair-loss' in alopecia http://bbc.in/1t9IVTf,pill reduces hair loss alopecia,POSITIVE
1663,1663,How safe is eating meat? http://bbc.in/1rKt6PT,how safe eating meat,NEUTRAL
1664,1664,Getting to grips with depression http://bbc.in/1yLnffE,getting grips depression,NEGATIVE
1665,1665,Alcohol tax urged to fund rehab http://bbc.in/1v2wjN5,alcohol tax urged fund rehab,NEUTRAL
1666,1666,Lesser-known things about Asperger's syndrome http://bbc.in/1mUmyLs,lesser known things asperger syndrome,NEUTRAL
1667,1667,VIDEO: Trapeze lessons 'help beat depression' http://bbc.in/1pmJw2a,video trapeze lessons help beat depression,NEUTRAL
1668,1668,Depression with Parkinson's 'common' http://bbc.in/1pmFx5H,depression parkinson common,NEUTRAL
1669,1669,VIDEO: Is it Salmonella or a tummy bug? http://bbc.in/1plIbbS,video is salmonella tummy bug,NEGATIVE
1670,1670,Ebola 'to last at least six months' http://bbc.in/1uCjQ5h,ebola last least six months,NEUTRAL
